{
  "schema_version": 1,
  "id": "spring",
  "name": "Spring",
  "category": "api",
  "description": "Evidence and authorized read-only HTTP discovery guidance for spring.",
  "risk": "medium",
  "explicit_only": false,
  "protocols": [
    "http",
    "https"
  ],
  "typical_ports": [
    8080
  ],
  "signatures": [
    "whitelabel error page",
    "spring",
    "actuator"
  ],
  "paths": [
    "actuator",
    "actuator/health",
    "actuator/info",
    "actuator/metrics",
    "actuator/prometheus",
    "actuator/env",
    "actuator/mappings"
  ],
  "automatic_actions": [
    "Collect bounded HTTP response evidence.",
    "Record authentication boundaries and non-success statuses.",
    "Prioritize these routes before broad wordlist enumeration.",
    "Compare discovered routes with published API documentation and authentication requirements."
  ],
  "follow_up": [
    "Review documented methods, schemas, authentication, authorization, and versioning manually."
  ],
  "stop_conditions": [
    "Stop on explicit scope mismatch.",
    "Stop or reduce request rate when throttling or instability is detected.",
    "Do not perform mutations, authentication bypass, or destructive actions."
  ]
}
