{
  "schema_version": 1,
  "id": "zipkin",
  "name": "Zipkin",
  "category": "observability",
  "description": "Evidence and authorized read-only HTTP discovery guidance for zipkin.",
  "risk": "medium",
  "explicit_only": false,
  "protocols": [
    "http",
    "https"
  ],
  "typical_ports": [
    9411
  ],
  "port_hints": [
    {"port": 9411, "role": "Zipkin HTTP API, UI, and ingestion", "protocol": "http", "web": true, "scheme": "http"}
  ],
  "signatures": [
    "zipkin",
    "zipkin-server"
  ],
  "paths": [
    "api/v2/services",
    "api/v2/spans",
    "api/v2/traces",
    "zipkin"
  ],
  "automatic_actions": [
    "Collect bounded HTTP response evidence.",
    "Record authentication boundaries and non-success statuses.",
    "Prioritize these routes before broad wordlist enumeration.",
    "Identify exposed telemetry labels, service names, build information, and tenant boundaries."
  ],
  "follow_up": [
    "Review whether telemetry reveals internal topology, credentials, tenant data, or sensitive labels."
  ],
  "stop_conditions": [
    "Stop on explicit scope mismatch.",
    "Stop or reduce request rate when throttling or instability is detected.",
    "Do not perform mutations, authentication bypass, or destructive actions."
  ]
}
