{
  "schema_version": 1,
  "id": "haproxy",
  "name": "Haproxy",
  "category": "gateway-proxy",
  "description": "Evidence and authorized read-only HTTP discovery guidance for haproxy.",
  "risk": "medium",
  "explicit_only": false,
  "protocols": [
    "http",
    "https"
  ],
  "typical_ports": [
    8404
  ],
  "port_hints": [
    {"port": 8404, "role": "HAProxy statistics and Prometheus metrics", "protocol": "http", "web": true, "scheme": "http"}
  ],
  "signatures": [
    "haproxy"
  ],
  "paths": [
    "haproxy?stats",
    "stats",
    "metrics"
  ],
  "automatic_actions": [
    "Collect bounded HTTP response evidence.",
    "Record authentication boundaries and non-success statuses.",
    "Prioritize these routes before broad wordlist enumeration.",
    "Compare gateway routes, upstream clues, and administrative exposure without modifying configuration."
  ],
  "follow_up": [
    "Review administrative interfaces, route exposure, upstream leakage, and authentication policy."
  ],
  "stop_conditions": [
    "Stop on explicit scope mismatch.",
    "Stop or reduce request rate when throttling or instability is detected.",
    "Do not perform mutations, authentication bypass, or destructive actions."
  ]
}
