{
  "schema_version": 1,
  "id": "pyroscope",
  "name": "Pyroscope",
  "category": "observability",
  "description": "Evidence and authorized read-only HTTP discovery guidance for pyroscope.",
  "risk": "medium",
  "explicit_only": false,
  "protocols": [
    "http",
    "https"
  ],
  "typical_ports": [
    4040
  ],
  "port_hints": [
    {"port": 4040, "role": "Pyroscope HTTP API and UI", "protocol": "http", "web": true, "scheme": "http"}
  ],
  "signatures": [
    "pyroscope",
    "pyroscope_build_info"
  ],
  "paths": [
    "-/healthy",
    "api/v1/label",
    "api/v1/render",
    "metrics"
  ],
  "automatic_actions": [
    "Collect bounded HTTP response evidence.",
    "Record authentication boundaries and non-success statuses.",
    "Prioritize these routes before broad wordlist enumeration.",
    "Identify exposed telemetry labels, service names, build information, and tenant boundaries."
  ],
  "follow_up": [
    "Review whether telemetry reveals internal topology, credentials, tenant data, or sensitive labels."
  ],
  "stop_conditions": [
    "Stop on explicit scope mismatch.",
    "Stop or reduce request rate when throttling or instability is detected.",
    "Do not perform mutations, authentication bypass, or destructive actions."
  ]
}
